{
  "classification": "Operations",
  "document_type": "Dispatch",
  "security": "The source (considered sensitive) of the information in paragraph 2. is Mrs. Nora BRITZIUS, a U. S. citizen employed by PAWLEY in the stamp business. The source volunteered the information on a very confidential basis to Helene I. DAHLERUP at a social gathering.",
  "security_level": "UNCLASSIFIED",
  "summary": "A dispatch from the Chief of Station in Ciudad Trujillo reports on William D. Pawley's business interests in the Dominican Republic, including mineral exploitation and a postage stamp concession managed by his brother.",
  "summary_one_paragraph": "This dispatch, dated June 12, 1958, from the Chief of Station in Ciudad Trujillo to the Chief of WHD, details William D. Pawley's business interests in the Dominican Republic. It highlights Pawley's substantial investments in mineral exploitation and his purchase of the Hotel Hamaca in Boca Chica. Additionally, it reveals Pawley's concession for the worldwide sale of Dominican postage stamps, managed discreetly by his brother, Edward P. Pawley, with information sourced confidentially from Nora Britzius, a U.S. citizen employed in the stamp business, to Helene I. Dahlerup at a social gathering.",
  "tags": [
    "William D. Pawley",
    "Dominican Republic",
    "Business Interests",
    "Mineral Exploitation",
    "Hotel Hamaca",
    "Postage Stamps",
    "Edward P. Pawley",
    "Nora Britzius",
    "Helene I. Dahlerup",
    "Ciudad Trujillo"
  ],
  "title": "GENERAL- Operational SPECIFIC PAWLEY Business Interests in the Dominican Republic",
  "date": "1958-06-12",
  "locations_mentioned": [
    "Dominican Republic",
    "Boca Chica",
    "Ciudad Trujillo"
  ],
  "origin_agency": "CIA",
  "persons_mentioned": [
    "William D. Pawley",
    "Edward P. Pawley",
    "Nora Britzius",
    "Helene I. Dahlerup"
  ],
  "recipient": "Chief, WHD",
  "sender": "Chief of Station, Ciudad Trujillo"
}