{
  "classification": "Cuba",
  "document_type": "Memorandum",
  "security": "Disclosing details about GICITRON-4, Errol R. Lythgoe, Reginald M. Dacie, and GICITRON-5—individuals and assets employed to support covert operations—could compromise operational security, endanger assets, and undermine ongoing covert activities. Specifically, the memo states that a cutback should be implemented given the targetting that will be made on them as the Cuban CI effort begins in the various countries.",
  "security_level": "TOP SECRET",
  "summary": "A memo discussing the operational security concerns related to Cuban assets in Latin America due to increasing Cuban diplomatic recognition and counterintelligence efforts. It specifically identifies assets GICITRON-4, Errol R. Lythgoe, Reginald M. Dacie, and GICITRON-5 in Bogota and discusses the need for a gradual cut-back in the use of Cuban assets, starting with Peru.",
  "summary_one_paragraph": "This Top Secret memorandum from August 1972 addresses the growing threat to CIA's Cuban assets in Latin America due to increased Cuban diplomatic presence and counterintelligence activities. The memo, addressed to WH/FI, discusses the vulnerability of assets like GICITRON-4, Errol R. Lythgoe, Reginald M. Dacie, and GICITRON-5 operating in Bogota and emphasizes the need for a gradual reduction in their use, beginning with Peru. The document highlights GICITRON-4's role in providing cover and funds for Errol R. LITHGOE and requests a review of all FORUMEN assets in the region to safeguard operational equities.",
  "tags": [
    "Cuban Assets",
    "Operational Security",
    "Counterintelligence",
    "Latin America",
    "GICITRON-4",
    "Errol R. Lythgoe",
    "Reginald M. Dacie",
    "GICITRON-5",
    "FORUMEN",
    "Bogota",
    "Peru"
  ],
  "title": "Results of Our Survey of Cuban Assets",
  "date": "1972-08-07",
  "locations_mentioned": [
    "Mexico",
    "Mexico City",
    "Cuba",
    "La Havana",
    "United States",
    "Peru",
    "Bogota",
    "Colombia"
  ],
  "origin_agency": "CIA",
  "persons_mentioned": [
    "Manuel Machado (Lioare)",
    "GICITRON-4",
    "Errol R. LITHGOE",
    "Reginald M. Dacie",
    "GICITRON-5"
  ],
  "recipient": "WH/FI",
  "sender": "C/UH/FI"
}