{
  "classification": "Administrative",
  "document_type": "Intelligence Checklist",
  "security": "This document is marked TOP SECRET and contains intelligence assessments and information that, if disclosed, could cause serious damage to national security. For example, details about Soviet missile capabilities and potential harassment tactics related to Berlin access routes are included. Directly quoting the document: 'For The President Only - Top Secret' and 'NATIONAL SECURITY INFORMATION Unauthorized Disclosure Subject to Criminal Sanctions'.",
  "security_level": "TOP SECRET",
  "summary": "This document is a CIA intelligence checklist for the President, dated November 23, 1963, covering various global hotspots including South Vietnam, Venezuela, Cuba, Berlin, Iraq-Syria-UAR, USSR, Congo, Britain, Ecuador and Thailand, along with Soviet space activities.",
  "summary_one_paragraph": "The President's Intelligence Checklist, issued by the CIA on November 23, 1963, provides a global overview of critical intelligence matters. It details Vietnamese Communist efforts to destabilize the new Saigon regime, terrorist outbursts in Venezuela supported by Castro, Cuban military messages indicating on-site training at surface-to-air missile (SAM) sites with Soviet assistance, potential Soviet harassment of Allied access routes to West Berlin, political instability in Iraq and Syria, indications of Soviet extended-range ICBM tests in the Pacific, Soviet complicity in anti-government plots in the Congo, political developments in Britain and Ecuador, the failing health of Thailand's Prime Minister, and the recovery of the Soviet satellite Cosmos 22.",
  "tags": [
    "CIA",
    "Intelligence Checklist",
    "South Vietnam",
    "Venezuela",
    "Cuba",
    "USSR",
    "Berlin",
    "Iraq",
    "Syria",
    "UAR",
    "Congo",
    "Britain",
    "Ecuador",
    "Thailand",
    "Soviet Space Program",
    "Cold War"
  ],
  "title": "THE PRESIDENT'S INTELLIGENCE CHECKLIST",
  "date": "1963-11-23",
  "origin_agency": "CIA",
  "recipient": "The President"
}